{
  "version": "0.6.0",
  "audit_id": "TAE-LIT-SUPPORT-V0.6.0",
  "audit_date": "2026-08-09",
  "manuscript": "paper/manuscript.md",
  "scope": "Sixteen material literature propositions in the current introduction and related-work draft.",
  "entries": [
    {"claim_id":"LIT-S01","locator":"Automation can leave people responsible","claim_summary":"Automation can weaken preparation for rare supervisory work.","citation_keys":["bainbridge1983ironies"],"review_basis":"full_text","support_state":"pass","scope_note":"Mechanism claim only; no universal failure claim."},
    {"claim_id":"LIT-S02","locator":"Green finds that government rules","claim_summary":"Some oversight rules assign review without establishing performance capacity.","citation_keys":["green2022flaws","zhu2026oversight"],"review_basis":"full_text","support_state":"pass","scope_note":"Institutional design proposition, not a measured prevalence claim."},
    {"claim_id":"LIT-S03","locator":"Four research streams answer parts","claim_summary":"The cited streams cover control, human factors, incident research, and assurance.","citation_keys":["santoni2018meaningful","siebert2023meaningful","bainbridge1983ironies","mcgregor2021incidents","burr2023ethical"],"review_basis":"mixed","support_state":"pass","scope_note":"Taxonomy of this working review."},
    {"claim_id":"LIT-S04","locator":"The closest prior work narrows","claim_summary":"Prior work covers reconstruction, intervention conditions, open-source classification, loss reconstruction, and prompt forensics.","citation_keys":["dekker2002reconstructing","mcdermid2019control","pittaras2023taxonomic","leung2026cer","ledjaki2026prompt"],"review_basis":"mixed","support_state":"pass","scope_note":"Similarity statement bounded to named mechanisms."},
    {"claim_id":"LIT-S05","locator":"Langer, Baum, and Schlicker separate","claim_summary":"Signal-detection theory separates detection sensitivity from response tendency in oversight.","citation_keys":["langer2024signal"],"review_basis":"abstract","support_state":"pass","scope_note":"The manuscript states the paper's declared model at abstract level."},
    {"claim_id":"LIT-S06","locator":"Langer, Lazar, and Baum show","claim_summary":"Checklist evidence can fail to establish practical oversight performance.","citation_keys":["langer2025testing"],"review_basis":"full_text","support_state":"pass","scope_note":"Context sensitivity and testing burden remain visible."},
    {"claim_id":"LIT-S07","locator":"Lam et al. formalize assurance audits","claim_summary":"A structured assurance-audit framework exists for algorithmic systems.","citation_keys":["lam2024assurance"],"review_basis":"full_text","support_state":"pass","scope_note":"No claim that this repository originated assurance audits."},
    {"claim_id":"LIT-S08","locator":"Gaube et al. supply a wider architecture","claim_summary":"A recent framework joins oversight definition, architecture, process, and documentation.","citation_keys":["gaube2026oversight"],"review_basis":"abstract","support_state":"pass","scope_note":"Preprint status and broad scope are retained."},
    {"claim_id":"LIT-S09","locator":"Santoni de Sio and van den Hoven define","claim_summary":"Meaningful human control includes tracking and tracing conditions.","citation_keys":["santoni2018meaningful"],"review_basis":"full_text","support_state":"pass","scope_note":"Philosophical account, not this paper's empirical result."},
    {"claim_id":"LIT-S10","locator":"Later work moves the concept","claim_summary":"Later work operationalizes control across ability, purpose, governance, teaming, and evaluative agency.","citation_keys":["siebert2023meaningful","davidovic2023purpose","calvert2025principles","tsamados2025control","zhu2026oversight"],"review_basis":"mixed","support_state":"pass","scope_note":"Sources supply distinct parts of the synthesis."},
    {"claim_id":"LIT-S11","locator":"Bainbridge shows how automation","claim_summary":"Automation can transfer difficult fallback work to less-practiced operators.","citation_keys":["bainbridge1983ironies","endsley2017autonomy","lee2004trust"],"review_basis":"full_text","support_state":"pass","scope_note":"Conditional mechanism claim."},
    {"claim_id":"LIT-S12","locator":"Human response to algorithmic advice is conditional","claim_summary":"Human use of algorithmic advice varies and can include bias or selective adherence.","citation_keys":["alonbarkat2023interactions","green2022flaws"],"review_basis":"full_text","support_state":"pass","scope_note":"Avoids a universal automation-bias claim."},
    {"claim_id":"LIT-S13","locator":"The AI Incident Database was created","claim_summary":"AIID supplies shared public incident infrastructure with variable records.","citation_keys":["mcgregor2021incidents","pittaras2023taxonomic","paeth2025lessons"],"review_basis":"mixed","support_state":"pass","scope_note":"Public-report uncertainty remains explicit."},
    {"claim_id":"LIT-S14","locator":"Macrae demonstrates that public investigative reports","claim_summary":"Public investigative reports can support sociotechnical incident analysis.","citation_keys":["macrae2022failure","ezell2025incident","wei2026reporting"],"review_basis":"mixed","support_state":"pass","scope_note":"The cited works serve related but distinct evidence functions."},
    {"claim_id":"LIT-S15","locator":"Argument-based assurance asks whether evidence","claim_summary":"Assurance structures claims, evidence, assumptions, and uncertainty.","citation_keys":["burr2023ethical","paterson2025safety"],"review_basis":"full_text","support_state":"pass","scope_note":"The manuscript does not call the case packets safety cases."},
    {"claim_id":"LIT-S16","locator":"ScientistOne supplies a closer architecture","claim_summary":"ScientistOne defines Chain-of-Evidence and four post-hoc integrity checks.","citation_keys":["meng2026scientistone"],"review_basis":"public_artifact","support_state":"pass","scope_note":"The repository claims an adaptation and no origination of those checks."}
  ],
  "limits": [
    "The audit covers the current material literature sentences and no future manuscript revision.",
    "Abstract-level review supports only claims within the source abstract.",
    "Institutional database searching and complete backward and forward citation review remain open.",
    "The audit supplies no novelty or systematic-review finding."
  ]
}
